{
  "schema_version": "1.0.0",
  "registry_status": "DESIGN_SCAFFOLD",
  "project_id": "A1",
  "artifacts": [
    {
      "artifact_id": "A1-TABLE-PRIMARY-MODEL-01",
      "artifact_revision": 1,
      "provisional": true,
      "artifact_type": "TABLE",
      "artifact_status": "SYNTHETIC_CANDIDATE",
      "title": "Synthetic WIDE locomotor-capacity primary model table",
      "caption_status": "SYNTHETIC_DISCLAIMER",
      "analysis_source": "K50 WIDE locomotor-capacity primary model table contract",
      "generator": {
        "status": "EXISTS",
        "path": "scripts/K50/K50.r",
        "repository_revision": "417290f223c0beef054410ee2b8135277dae93e3",
        "sha256": "03d7e68a11eb3e49135df023016736b1c2b20336e77e3af9ca5bddee8d12a42a"
      },
      "required_inputs": ["PUBLIC_SYNTHETIC_INPUT"],
      "data_classification": "PUBLIC_SYNTHETIC",
      "execution_environment": "PUBLIC_SYNTHETIC_K50_WIDE_CONTROL",
      "protected_execution_required": false,
      "scientific_approval_required": true,
      "disclosure_review_required": false,
      "disclosure_state": "NOT_APPLICABLE_SYNTHETIC",
      "publication_status": "NOT_APPROVED",
      "manuscript_destination": "NEEDS_VERIFICATION",
      "manuscript_reference_key": "NEEDS_VERIFICATION_A1_PRIMARY_MODEL_01",
      "provenance_required": true,
      "validation_required": true,
      "supersedes": null
    },
    {
      "artifact_id": "A1-SUPPLEMENT-QC-PROVENANCE-01",
      "artifact_revision": 1,
      "provisional": true,
      "artifact_type": "SUPPLEMENT",
      "artifact_status": "SYNTHETIC_CANDIDATE",
      "title": "Public synthetic QC and provenance bundle",
      "caption_status": "SYNTHETIC_DISCLAIMER",
      "analysis_source": "Deterministic public synthetic QC and provenance bundle contract",
      "generator": {
        "status": "EXISTS",
        "path": "scripts/demo/build_qc_provenance_bundle.py",
        "repository_revision": "3a908b7b0ccb8ec899bc5b9959bd2a7769cdec33",
        "sha256": "a17b7a315f2184005ec4489e10b23c95bf3da07e38de2d5b31e5b3de4c6bb3f6"
      },
      "required_inputs": ["PUBLIC_SYNTHETIC_INPUT"],
      "data_classification": "PUBLIC_SYNTHETIC",
      "execution_environment": "PUBLIC_SYNTHETIC_QC_PROVENANCE_BUNDLE",
      "protected_execution_required": false,
      "scientific_approval_required": false,
      "disclosure_review_required": false,
      "disclosure_state": "NOT_APPLICABLE_SYNTHETIC",
      "publication_status": "NOT_APPROVED",
      "manuscript_destination": "NEEDS_VERIFICATION",
      "manuscript_reference_key": "NEEDS_VERIFICATION_A1_QC_PROVENANCE_01",
      "provenance_required": true,
      "validation_required": true,
      "supersedes": null
    },
    {
      "artifact_id": "A1-SUPPLEMENT-MISSINGNESS-01",
      "artifact_revision": 1,
      "provisional": true,
      "artifact_type": "SUPPLEMENT",
      "artifact_status": "SYNTHETIC_CANDIDATE",
      "title": "Synthetic group and time aggregate missingness table",
      "caption_status": "SYNTHETIC_DISCLAIMER",
      "analysis_source": "K50 group and time aggregate missingness table contract",
      "generator": {
        "status": "EXISTS",
        "path": "scripts/K50/K50.r",
        "repository_revision": "417290f223c0beef054410ee2b8135277dae93e3",
        "sha256": "03d7e68a11eb3e49135df023016736b1c2b20336e77e3af9ca5bddee8d12a42a"
      },
      "required_inputs": ["PUBLIC_SYNTHETIC_INPUT"],
      "data_classification": "PUBLIC_SYNTHETIC",
      "execution_environment": "PUBLIC_SYNTHETIC_K50_WIDE_CONTROL",
      "protected_execution_required": false,
      "scientific_approval_required": true,
      "disclosure_review_required": false,
      "disclosure_state": "NOT_APPLICABLE_SYNTHETIC",
      "publication_status": "NOT_APPROVED",
      "manuscript_destination": "NEEDS_VERIFICATION",
      "manuscript_reference_key": "NEEDS_VERIFICATION_A1_MISSINGNESS_01",
      "provenance_required": true,
      "validation_required": true,
      "supersedes": null
    },
    {
      "artifact_id": "A1-SUPPLEMENT-Z3-SENSITIVITY-01",
      "artifact_revision": 1,
      "provisional": true,
      "artifact_type": "SUPPLEMENT",
      "artifact_status": "SYNTHETIC_CANDIDATE",
      "title": "Synthetic Z3 fallback sensitivity model table",
      "caption_status": "SYNTHETIC_DISCLAIMER",
      "analysis_source": "K50 fallback Z3 sensitivity model table contract",
      "generator": {
        "status": "EXISTS",
        "path": "scripts/K50/K50.r",
        "repository_revision": "417290f223c0beef054410ee2b8135277dae93e3",
        "sha256": "03d7e68a11eb3e49135df023016736b1c2b20336e77e3af9ca5bddee8d12a42a"
      },
      "required_inputs": ["PUBLIC_SYNTHETIC_INPUT"],
      "data_classification": "PUBLIC_SYNTHETIC",
      "execution_environment": "PUBLIC_SYNTHETIC_K50_WIDE_CONTROL",
      "protected_execution_required": false,
      "scientific_approval_required": true,
      "disclosure_review_required": false,
      "disclosure_state": "NOT_APPLICABLE_SYNTHETIC",
      "publication_status": "NOT_APPROVED",
      "manuscript_destination": "NEEDS_VERIFICATION",
      "manuscript_reference_key": "NEEDS_VERIFICATION_A1_Z3_SENSITIVITY_01",
      "provenance_required": true,
      "validation_required": true,
      "supersedes": null
    },
    {
      "artifact_id": "A1-SUPPLEMENT-FI22-SENSITIVITY-01",
      "artifact_revision": 1,
      "provisional": true,
      "artifact_type": "SUPPLEMENT",
      "artifact_status": "SYNTHETIC_CANDIDATE",
      "title": "Synthetic FI22 sensitivity model table",
      "caption_status": "SYNTHETIC_DISCLAIMER",
      "analysis_source": "K50 explicit --fi22 on sensitivity model table contract",
      "generator": {
        "status": "EXISTS",
        "path": "scripts/K50/K50.r",
        "repository_revision": "417290f223c0beef054410ee2b8135277dae93e3",
        "sha256": "03d7e68a11eb3e49135df023016736b1c2b20336e77e3af9ca5bddee8d12a42a"
      },
      "required_inputs": ["PUBLIC_SYNTHETIC_INPUT"],
      "data_classification": "PUBLIC_SYNTHETIC",
      "execution_environment": "PUBLIC_SYNTHETIC_K50_WIDE_CONTROL",
      "protected_execution_required": false,
      "scientific_approval_required": true,
      "disclosure_review_required": false,
      "disclosure_state": "NOT_APPLICABLE_SYNTHETIC",
      "publication_status": "NOT_APPROVED",
      "manuscript_destination": "NEEDS_VERIFICATION",
      "manuscript_reference_key": "NEEDS_VERIFICATION_A1_FI22_SENSITIVITY_01",
      "provenance_required": true,
      "validation_required": true,
      "supersedes": null
    }
  ]
}
