{
  "schema_version": "1.0.0",
  "registry_status": "ACTIVE",
  "project_id": "A1",
  "artifacts": [{
    "artifact_id": "TEST-FIG-SYNTH-01",
    "artifact_revision": 1,
    "provisional": true,
    "artifact_type": "FIGURE",
    "artifact_status": "SYNTHETIC_VALIDATED",
    "title": "Validated synthetic test figure",
    "caption_status": "SYNTHETIC_DISCLAIMER",
    "analysis_source": "Wholly synthetic fixture",
    "generator": {
      "status": "EXISTS",
      "path": "scripts/demo/run_public_traceability.R",
      "repository_revision": "aaaaaaaaaaaaaaaaaaaaaaaaaaaaaaaaaaaaaaaa",
      "sha256": "bbbbbbbbbbbbbbbbbbbbbbbbbbbbbbbbbbbbbbbbbbbbbbbbbbbbbbbbbbbbbbbb"
    },
    "required_inputs": ["PUBLIC_SYNTHETIC_INPUT"],
    "data_classification": "PUBLIC_SYNTHETIC",
    "execution_environment": "PUBLIC_SYNTHETIC_TEST",
    "protected_execution_required": false,
    "scientific_approval_required": false,
    "disclosure_review_required": false,
    "disclosure_state": "NOT_APPLICABLE_SYNTHETIC",
    "publication_status": "NOT_PROPOSED",
    "candidate_output_path": "outputs/figures/test_synthetic_validated.png",
    "manuscript_destination": "SYNTHETIC_DEMO_ONLY",
    "manuscript_reference_key": "TEST_FIG_SYNTH_01",
    "provenance_required": true,
    "validation_required": true,
    "validation_receipt_reference": "TEST_SYNTHETIC_VALIDATION_01",
    "artifact_sha256": "cccccccccccccccccccccccccccccccccccccccccccccccccccccccccccccccc",
    "supersedes": null
  }]
}
